Name,Location,Message,Date,Replies
Shailendra Dhakad,New Delhi,Crop Suggestion is Good. This is helpful for finding prices.,2025-10-05 23:01,"Thanks | Thanks | Thanks
 | Very Nice | Very Nice"
Priya ,Mumbai,"This platform is very helpful for farmers. Farmers can see prices , weather, crop recommendation. ",2025-10-05 23:30,nan | Thank You | Very Nice | Very Nice
kajal,Mumbai,Good platform. It is helpful for farmers.,2025-10-05 23:33,nan | Thankyou | Thankyou
Ram Prakash,Rajathan,I want to know how to grow peas so that this is benificial and as soon as possible grow.,2025-10-06 10:12,nan | Grow the peas at the winter vacation. | Grow the peas at the winter vacation.
Kamal Thakur,Indore,Please give suggestion for farming. How can I do farming of tomato. This is my first time farming.,2025-10-06 11:55,nan | You can use technology for farming. | You can use technology for farming.
Sataym,New Delhi,Tell me about farming.,2025-10-06 12:04,nan | Farming | Farming | Farming is good.
